{
  "schemaVersion": 1,
  "id": "chain-cycle",
  "name": "Chain cycle",
  "baseUrl": "BASE_URL",
  "variables": {},
  "environments": [
    {
      "name": "test",
      "variables": {
        "documento": "12345678"
      }
    }
  ],
  "auth": {
    "type": "none"
  },
  "endpoints": [
    {
      "id": "a",
      "name": "A",
      "method": "GET",
      "path": "/a",
      "headers": {},
      "query": {},
      "variables": {},
      "auth": {
        "type": "chained",
        "source": {
          "endpoint": "b"
        },
        "inject": {
          "into": "header",
          "name": "Authorization",
          "template": "Bearer {{value}}"
        }
      }
    },
    {
      "id": "b",
      "name": "B",
      "method": "GET",
      "path": "/b",
      "headers": {},
      "query": {},
      "variables": {},
      "auth": {
        "type": "chained",
        "source": {
          "endpoint": "a"
        },
        "inject": {
          "into": "header",
          "name": "Authorization",
          "template": "Bearer {{value}}"
        }
      }
    }
  ]
}
