{
  "schemaVersion": 1,
  "id": "chain-too-deep",
  "name": "Chain too deep",
  "baseUrl": "BASE_URL",
  "variables": {},
  "environments": [
    {
      "name": "test",
      "variables": {
        "person_id": "12345678"
      }
    }
  ],
  "auth": {
    "type": "none"
  },
  "endpoints": [
    {
      "id": "a",
      "name": "A",
      "method": "GET",
      "path": "/a",
      "headers": {},
      "query": {},
      "variables": {},
      "auth": {
        "type": "chained",
        "source": {
          "endpoint": "b"
        },
        "extract": {
          "from": "body",
          "jsonPath": "$.access_token"
        },
        "ttl": {
          "from": "body",
          "jsonPath": "$.expires_in",
          "unit": "seconds"
        },
        "inject": {
          "into": "header",
          "name": "Authorization",
          "template": "Bearer {{value}}"
        }
      }
    },
    {
      "id": "b",
      "name": "B",
      "method": "GET",
      "path": "/b",
      "headers": {},
      "query": {},
      "variables": {},
      "auth": {
        "type": "chained",
        "source": {
          "endpoint": "c"
        },
        "extract": {
          "from": "body",
          "jsonPath": "$.access_token"
        },
        "ttl": {
          "from": "body",
          "jsonPath": "$.expires_in",
          "unit": "seconds"
        },
        "inject": {
          "into": "header",
          "name": "Authorization",
          "template": "Bearer {{value}}"
        }
      }
    },
    {
      "id": "c",
      "name": "C",
      "method": "GET",
      "path": "/c",
      "headers": {},
      "query": {},
      "variables": {},
      "auth": {
        "type": "chained",
        "source": {
          "endpoint": "d"
        },
        "extract": {
          "from": "body",
          "jsonPath": "$.access_token"
        },
        "ttl": {
          "from": "body",
          "jsonPath": "$.expires_in",
          "unit": "seconds"
        },
        "inject": {
          "into": "header",
          "name": "Authorization",
          "template": "Bearer {{value}}"
        }
      }
    },
    {
      "id": "d",
      "name": "D",
      "method": "GET",
      "path": "/d",
      "headers": {},
      "query": {},
      "variables": {},
      "auth": {
        "type": "chained",
        "source": {
          "endpoint": "e"
        },
        "extract": {
          "from": "body",
          "jsonPath": "$.access_token"
        },
        "ttl": {
          "from": "body",
          "jsonPath": "$.expires_in",
          "unit": "seconds"
        },
        "inject": {
          "into": "header",
          "name": "Authorization",
          "template": "Bearer {{value}}"
        }
      }
    },
    {
      "id": "e",
      "name": "E",
      "method": "GET",
      "path": "/e",
      "headers": {},
      "query": {},
      "variables": {},
      "auth": {
        "type": "chained",
        "source": {
          "endpoint": "f"
        },
        "extract": {
          "from": "body",
          "jsonPath": "$.access_token"
        },
        "ttl": {
          "from": "body",
          "jsonPath": "$.expires_in",
          "unit": "seconds"
        },
        "inject": {
          "into": "header",
          "name": "Authorization",
          "template": "Bearer {{value}}"
        }
      }
    },
    {
      "id": "f",
      "name": "F",
      "method": "GET",
      "path": "/f",
      "headers": {},
      "query": {},
      "variables": {},
      "auth": {
        "type": "none"
      }
    }
  ]
}
